{
  "schema": "axiom-curriculum-source-lock.v1",
  "source_id": "ontario-fr-francais-grades-1-8-2023",
  "jurisdiction_id": "ca:on",
  "authority_id": "gov:ontario:ministry-of-education",
  "discovery_path": "curriculum/ontario-elementary/source-discovery.v0.json",
  "source_entry_sha256": "a49cdbac8cdd8a143e1a2cdfef9e74f76f8892d49e9c4cfcb73801f95bd43cb6",
  "capture_method": "local-file-hash",
  "captured_at": "2026-08-20T21:50:41.954409Z",
  "source_locator": "https://www.dcp.edu.gov.on.ca/fr/curriculum/elementaire-francais",
  "resolved_locator": "https://www.dcp.edu.gov.on.ca/fr/curriculum/elementaire-francais",
  "media_type": "text/html",
  "byte_length": 6459273,
  "sha256": "0ee8c811b38707cbc6d5b21d2217f7737a5ad12126fec078ddcf1923584978d8",
  "bytes_retained": false,
  "retained_path": null,
  "redistribution_status": "review-required",
  "claim_state": "C1-bytes-captured-digested",
  "notes": "Allowlisted hosted capture from workflow run 32421398988. Candidate and all three stability probes were byte-identical. Source bytes were discarded after hashing; this historical C1 snapshot does not approve redistribution, normalization, review, staging, or activation."
}
