{
  "schema": "axiom-curriculum-source-lock.v1",
  "source_id": "ontario-language-grades-1-8-2023",
  "jurisdiction_id": "ca:on",
  "authority_id": "gov:ontario:ministry-of-education",
  "discovery_path": "curriculum/ontario-elementary/source-discovery.v0.json",
  "source_entry_sha256": "9c06e628c0ae0627421a6a8b79a40760f62e4e08cbfb6bbaf36c11ee4b3f0b2c",
  "capture_method": "local-file-hash",
  "captured_at": "2026-08-11T21:35:47.251406Z",
  "source_locator": "https://www.dcp.edu.gov.on.ca/en/curriculum/elementary-language",
  "resolved_locator": "https://www.dcp.edu.gov.on.ca/en/curriculum/elementary-language",
  "media_type": "text/html",
  "byte_length": 6179533,
  "sha256": "af13e2d35da023bd888d7f11b5b1ee1464db2d54b6e74db144ac43a8152821e5",
  "bytes_retained": false,
  "retained_path": null,
  "redistribution_status": "review-required",
  "claim_state": "C1-bytes-captured-digested",
  "notes": "Allowlisted remote capture target 9a6072817a97cad48bdb2beb0d5996b795f258bf83e32e189b60bf75d4e74d1e. GitHub run 31538611554 attempt 1. Downloaded source bytes were discarded after hashing; this lock candidate does not approve redistribution."
}
